{
  "name": "skill-experience-logger",
  "version": "1.0.0",
  "type": "skill",
  "description": "经验记录与提取 Skill - 分类记录开发经验教训，支持角色专属经验库和双重写入策略",
  "triggers": ["总结经验", "记录经验", "这次学到了", "experience-logger"],
  "dependencies": ["provider:memory-store"],
  "provides": ["skill:experience-logger"],
  "config": {}
}
