{
  "name": "skill-agent-dispatcher",
  "version": "1.3.0",
  "type": "skill",
  "description": "Use when user says \"批量执行\", \"并行执行\", \"调度子代理\", or needs to execute multiple work packages using Agent subagents. Analyzes dependencies and dispatches tasks in parallel or sequential order.",
  "triggers": ["批量执行", "并行执行", "调度子代理", "agent-dispatcher", "batch execute", "parallel execute", "dispatch agents"],
  "dependencies": ["provider:role-registry", "provider:memory-store"],
  "provides": ["skill:agent-dispatcher"],
  "metadata": {
    "gatedByCode": true
  },
  "config": {}
}
