{
  "name": "skill-role-manager",
  "version": "1.0.0",
  "type": "skill",
  "description": "Use when user says \"查看角色\", \"匹配角色\", \"角色管理\", or needs to work with the role empowerment system for subagents",
  "triggers": ["查看角色", "列出角色", "匹配角色", "角色管理", "角色信息", "角色统计", "view roles", "list roles", "role management"],
  "dependencies": ["provider:role-registry"],
  "provides": ["skill:role-manager"],
  "config": {}
}
