{
  "name": "skill-batch-task-creator",
  "version": "1.0.0",
  "type": "skill",
  "description": "批量任务创建 Skill - 批量创建工作包定义（仅定义不实现），支持跨任务依赖声明和全局依赖图生成",
  "triggers": ["批量创建任务", "批量新建任务", "batch-task-creator", "batch create tasks", "create multiple tasks"],
  "dependencies": ["provider:state-store"],
  "provides": ["skill:batch-task-creator"],
  "metadata": {
    "gatedByCode": true
  },
  "config": {}
}
